{
  "schemaVersion": "continuous_strategy_result_rules_v1",
  "contentVersion": "sangtian_v1_2",
  "publicStageRules": [
    {
      "ruleKey": "public_result_s1",
      "stageKey": "s1_change_mulberry_order",
      "candidateFactKeys": [
        "fact_s1_governor_joint_review",
        "fact_s1_governor_pause_one_county",
        "fact_s1_governor_endorse_fast_execution",
        "fact_s1_xunfu_accelerate_orders",
        "fact_s1_xunfu_publish_progress",
        "fact_s1_xunfu_reserve_review_window",
        "fact_s1_magistrate_retain_original_register",
        "fact_s1_magistrate_phase_execution",
        "fact_s1_magistrate_submit_copy_for_protection",
        "fact_s1_clerk_preserve_register_chain",
        "fact_s1_clerk_compare_order_seals",
        "fact_s1_clerk_report_altered_entry",
        "fact_s1_merchant_offer_auditable_credit",
        "fact_s1_merchant_cap_contract_prices",
        "fact_s1_merchant_refuse_secret_kickback",
        "fact_s1_sili_audit_edict_copies",
        "fact_s1_sili_monitor_rush_orders",
        "fact_s1_sili_request_sealed_report"
      ],
      "outcomeStateKey": "state_s2_county_secret_letter_open",
      "summary": "改桑急令形成了可审计的执行边界；速度、复核和县册去向开始互相制约。"
    },
    {
      "ruleKey": "public_result_s2",
      "stageKey": "s2_county_secret_letter",
      "candidateFactKeys": [
        "fact_s2_governor_receive_letter_privately",
        "fact_s2_governor_dual_verification",
        "fact_s2_governor_request_original",
        "fact_s2_xunfu_trace_leak",
        "fact_s2_xunfu_seize_drafts",
        "fact_s2_xunfu_challenge_letter",
        "fact_s2_magistrate_send_copy",
        "fact_s2_magistrate_hide_original",
        "fact_s2_magistrate_trade_protection",
        "fact_s2_clerk_verify_letter_register",
        "fact_s2_clerk_protect_courier_record",
        "fact_s2_clerk_expose_copied_seal",
        "fact_s2_merchant_escrow_deed_copies",
        "fact_s2_merchant_reveal_official_ious",
        "fact_s2_merchant_protect_letter_courier",
        "fact_s2_sili_trace_unauthorized_memorial",
        "fact_s2_sili_secure_imperial_courier",
        "fact_s2_sili_compare_official_seals"
      ],
      "outcomeStateKey": "state_s3_grain_price_crisis_open",
      "summary": "县令密信迫使三方明确证据由谁保管、谁能核验，以及拒绝交出原件的代价。"
    },
    {
      "ruleKey": "public_result_s3",
      "stageKey": "s3_grain_price_crisis",
      "candidateFactKeys": [
        "fact_s3_governor_release_granary",
        "fact_s3_governor_audit_merchants",
        "fact_s3_governor_unify_price_message",
        "fact_s3_xunfu_blame_merchants",
        "fact_s3_xunfu_summon_dealers",
        "fact_s3_xunfu_accelerate_levy",
        "fact_s3_magistrate_publish_loss",
        "fact_s3_magistrate_organize_petitions",
        "fact_s3_magistrate_protect_local_granary",
        "fact_s3_clerk_reconcile_grain_books",
        "fact_s3_clerk_trace_warehouse_receipts",
        "fact_s3_clerk_publish_inventory_variance",
        "fact_s3_merchant_release_grain_openly",
        "fact_s3_merchant_disclose_true_inventory",
        "fact_s3_merchant_negotiate_price_ceiling",
        "fact_s3_sili_inspect_silver_grain_flow",
        "fact_s3_sili_question_merchant_records",
        "fact_s3_sili_report_market_manipulation"
      ],
      "outcomeStateKey": "state_s4_hidden_ledger_open",
      "summary": "粮价危机将每个人此前的执行选择转换为官仓余量、商会压力和可归责的价格口径。"
    },
    {
      "ruleKey": "public_result_s4",
      "stageKey": "s4_hidden_ledger",
      "candidateFactKeys": [
        "fact_s4_governor_seal_evidence",
        "fact_s4_governor_protect_witness",
        "fact_s4_governor_control_access",
        "fact_s4_xunfu_challenge_integrity",
        "fact_s4_xunfu_seize_original",
        "fact_s4_xunfu_cut_off_aide",
        "fact_s4_magistrate_send_copy",
        "fact_s4_magistrate_move_original",
        "fact_s4_magistrate_protect_witness",
        "fact_s4_clerk_index_shadow_ledger",
        "fact_s4_clerk_secure_witness_notes",
        "fact_s4_clerk_certify_transfer_chain",
        "fact_s4_merchant_surrender_duplicate_ledger",
        "fact_s4_merchant_protect_accountants",
        "fact_s4_merchant_suspend_suspect_credit",
        "fact_s4_sili_seize_weaving_correspondence",
        "fact_s4_sili_protect_palace_witness",
        "fact_s4_sili_isolate_corrupt_agents"
      ],
      "outcomeStateKey": "state_s5_mutual_impeachment_open",
      "summary": "暗账的效力不再由文案决定，而由原件去向、证人保护和每次接触的可追溯记录决定。"
    },
    {
      "ruleKey": "public_result_s5",
      "stageKey": "s5_mutual_impeachment",
      "candidateFactKeys": [
        "fact_s5_governor_split_liability",
        "fact_s5_governor_suppress_unsupported",
        "fact_s5_governor_impeach_abuse",
        "fact_s5_xunfu_impeach_delay",
        "fact_s5_xunfu_claim_credit",
        "fact_s5_xunfu_counter_accuse",
        "fact_s5_magistrate_prove_overreach",
        "fact_s5_magistrate_request_public_audit",
        "fact_s5_magistrate_preserve_sources",
        "fact_s5_clerk_map_orders_to_signatures",
        "fact_s5_clerk_submit_clerk_chronology",
        "fact_s5_clerk_disclose_document_coercion",
        "fact_s5_merchant_publish_transaction_chronology",
        "fact_s5_merchant_answer_official_accusations",
        "fact_s5_merchant_separate_public_private_accounts",
        "fact_s5_sili_compare_impeachment_memorials",
        "fact_s5_sili_expose_report_conflicts",
        "fact_s5_sili_prevent_evidence_suppression"
      ],
      "outcomeStateKey": "state_s6_capital_reply_open",
      "summary": "弹劾不再是空泛指控；每份责任叙事都必须对应前序命令、证据接触和粮价事实。"
    },
    {
      "ruleKey": "public_result_s6",
      "stageKey": "s6_capital_reply",
      "candidateFactKeys": [
        "fact_s6_governor_consolidate_memorial",
        "fact_s6_governor_accept_review_duty",
        "fact_s6_governor_preserve_flexibility",
        "fact_s6_xunfu_secret_merit_report",
        "fact_s6_xunfu_minimize_ledger",
        "fact_s6_xunfu_demand_closure",
        "fact_s6_magistrate_submit_evidence_index",
        "fact_s6_magistrate_attach_petitions",
        "fact_s6_magistrate_protect_sources",
        "fact_s6_clerk_seal_source_index",
        "fact_s6_clerk_cross_check_memorial_annex",
        "fact_s6_clerk_preserve_verified_duplicate",
        "fact_s6_merchant_submit_silver_route_report",
        "fact_s6_merchant_reject_immunity_trade",
        "fact_s6_merchant_guarantee_emergency_supply",
        "fact_s6_sili_transmit_complete_dossier",
        "fact_s6_sili_flag_memorial_omissions",
        "fact_s6_sili_protect_imperial_channel"
      ],
      "outcomeStateKey": "state_s7_imperial_judgment_open",
      "summary": "最终奏报把粮价、田契、暗账、责任和来源保护压缩为一份可被御前逐条追问的记录。"
    },
    {
      "ruleKey": "public_result_s7",
      "stageKey": "s7_imperial_judgment",
      "candidateFactKeys": [
        "fact_s7_governor_state_stability_case",
        "fact_s7_governor_accept_final_duty",
        "fact_s7_governor_defend_local_flexibility",
        "fact_s7_xunfu_defend_execution",
        "fact_s7_xunfu_admit_costs",
        "fact_s7_xunfu_seek_forced_acquittal",
        "fact_s7_magistrate_submit_final_index",
        "fact_s7_magistrate_plead_for_people",
        "fact_s7_magistrate_shield_sources",
        "fact_s7_clerk_testify_document_chain",
        "fact_s7_clerk_present_alteration_timeline",
        "fact_s7_clerk_request_witness_protection",
        "fact_s7_merchant_open_complete_ledgers",
        "fact_s7_merchant_accept_commercial_liability",
        "fact_s7_merchant_preserve_grain_supply",
        "fact_s7_sili_present_inner_court_audit",
        "fact_s7_sili_separate_policy_from_corruption",
        "fact_s7_sili_request_evidence_judgment"
      ],
      "outcomeStateKey": "state_run_completed",
      "summary": "御前裁决以七阶段行动、跨角色影响、证据链和奏报差异为依据，形成一个公共结局与三条个人命运。"
    }
  ],
  "personalStageRules": [
    {
      "ruleKey": "personal_result_s1_governor",
      "stageKey": "s1_change_mulberry_order",
      "roleKey": "zhejiang_governor",
      "candidateFactKeys": [
        "fact_s1_governor_joint_review",
        "fact_s1_governor_pause_one_county",
        "fact_s1_governor_endorse_fast_execution"
      ],
      "summary": "总督本轮的复核边界决定了他日后能否解释浙江执行失衡。"
    },
    {
      "ruleKey": "personal_result_s1_xunfu",
      "stageKey": "s1_change_mulberry_order",
      "roleKey": "xunfu",
      "candidateFactKeys": [
        "fact_s1_xunfu_accelerate_orders",
        "fact_s1_xunfu_publish_progress",
        "fact_s1_xunfu_reserve_review_window"
      ],
      "summary": "巡抚本轮留下的进度承诺会在后续粮价和弹劾中转化为个人责任。"
    },
    {
      "ruleKey": "personal_result_s1_magistrate",
      "stageKey": "s1_change_mulberry_order",
      "roleKey": "county_magistrate",
      "candidateFactKeys": [
        "fact_s1_magistrate_retain_original_register",
        "fact_s1_magistrate_phase_execution",
        "fact_s1_magistrate_submit_copy_for_protection"
      ],
      "summary": "县令是否保住原件以及谁收到副本，将决定后续密信和暗账的可信度。"
    },
    {
      "ruleKey": "personal_result_s2_governor",
      "stageKey": "s2_county_secret_letter",
      "roleKey": "zhejiang_governor",
      "candidateFactKeys": [
        "fact_s2_governor_receive_letter_privately",
        "fact_s2_governor_dual_verification",
        "fact_s2_governor_request_original"
      ],
      "summary": "总督如何接信与核验，决定他掌握的是情报、证据还是新的政治债务。"
    },
    {
      "ruleKey": "personal_result_s2_xunfu",
      "stageKey": "s2_county_secret_letter",
      "roleKey": "xunfu",
      "candidateFactKeys": [
        "fact_s2_xunfu_trace_leak",
        "fact_s2_xunfu_seize_drafts",
        "fact_s2_xunfu_challenge_letter"
      ],
      "summary": "巡抚的调查方式决定密信会成为反证、把柄还是可共同核验的事实。"
    },
    {
      "ruleKey": "personal_result_s2_magistrate",
      "stageKey": "s2_county_secret_letter",
      "roleKey": "county_magistrate",
      "candidateFactKeys": [
        "fact_s2_magistrate_send_copy",
        "fact_s2_magistrate_hide_original",
        "fact_s2_magistrate_trade_protection"
      ],